{"data": {"code": "owner_lease_expired", "cost": null, "usage": {"billing": {"status": "inactive"}, "cost_usd": null, "sprite_ms": 0, "tool_calls": 0, "usage_cost": {"as_of": "2026-10-13T20:45:39.768914+02:00", "basis": "none", "status": "complete", "totals": [], "revision": 3, "scope_status": "closed", "invocation_count": 0, "priced_subtotals": [], "pending_invocation_count": 0}, "duration_ms": 30, "input_tokens": 0, "output_tokens": 0, "sprite_ram_gb_ms": 0}, "message": "turn interrupted by gateway restart", "turn_id": "cmpl_06GKD5D73FRKS71PKVF2SGSFHM", "chat_cost": null, "chat_usage": {"cost_usd": null, "sprite_ms": 0, "tool_calls": 0, "duration_ms": 30, "input_tokens": 0, "output_tokens": 0, "sprite_ram_gb_ms": 0}}, "event_id": "evt_01M4V9B9STNJNZ6BPVBXJ7YJ1R", "event_type": "turn.failed", "occurred_at": "2026-10-13T18:45:39.770027099Z"}