{"data": {"cost": 0, "usage": {"billing": {"status": "inactive"}, "cost_usd": 0, "sprite_ms": 0, "tool_calls": 0, "usage_cost": {"as_of": "2026-10-13T20:45:39.790709+02:00", "basis": "none", "status": "complete", "totals": [], "revision": 2, "scope_status": "closed", "invocation_count": 0, "priced_subtotals": [], "pending_invocation_count": 0}, "duration_ms": 4, "input_tokens": 5, "output_tokens": 3, "sprite_ram_gb_ms": 0}, "turn_id": "cmpl_06GKD5D78YZ4VKPPD18V9HNAK8", "chat_cost": 0, "chat_usage": {"cost_usd": 0, "sprite_ms": 0, "tool_calls": 0, "duration_ms": 4, "input_tokens": 5, "output_tokens": 3, "sprite_ram_gb_ms": 0}, "finish_reason": "stop"}, "event_id": "evt_06GKD5D7A6M04RS5PGZ13Y0R2C", "event_type": "turn.completed", "occurred_at": "2026-10-13T18:45:39.792070799Z"}