{
  "event_id": "evt_01j5abcdefghjkmnpqrstvwxyy",
  "occurred_at": "2026-10-13T16:01:00Z",
  "event_type": "turn.failed",
  "data": {
    "turn_id": "cmpl_01j5abcdefghjkmnpqrstvwxyz",
    "code": "owner_lease_expired",
    "message": "turn interrupted by gateway restart",
    "cost": null,
    "usage": {
      "input_tokens": 10,
      "output_tokens": 20,
      "duration_ms": 30,
      "sprite_ms": 0,
      "sprite_ram_gb_ms": 0,
      "tool_calls": 0,
      "cost_usd": null,
      "billing": {
        "status": "inactive"
      },
      "usage_cost": {
        "status": "pending",
        "basis": "mixed",
        "scope_status": "closed",
        "revision": 3,
        "as_of": "2026-10-13T16:00:00Z",
        "invocation_count": 7,
        "pending_invocation_count": 1,
        "totals": null,
        "priced_subtotals": [
          {
            "currency": "USD",
            "amount": "0.01234000"
          }
        ]
      }
    },
    "chat_cost": null,
    "chat_usage": {
      "input_tokens": 40,
      "output_tokens": 60,
      "cost_usd": null,
      "duration_ms": 90,
      "sprite_ms": 0,
      "sprite_ram_gb_ms": 0,
      "tool_calls": 0
    }
  }
}
